Id,Name,Tel,Add,Px,Py
524,瑞三鑛業整煤廠,886-2-24974168,新北市224瑞芳區新北市瑞芳區柴寮路36-2號,121.82754,25.08665
525,新莊體育園區,886-2-29981382,新北市242新莊區和興街66號,121.44644,25.04138
526,連淨綠色科技概念館,886-2-29175526#2790,新北市231新店區寶興路45巷9弄4號1樓,121.54951,24.97477
527,永和樂華夜市,886-2-29282828,新北市234永和區樂華夜市,121.51173,25.00842
528,龜吼漁港,886-2-89526055,新北市207萬里區漁澳路85-3號(龜吼漁港安檢所),121.68895,25.19649
529,南雅奇岩(南雅奇石),886-2-24972250,新北市224瑞芳區南雅里濱海公路,121.8928,25.1196
530,板橋湳雅觀光夜市,886-2-29686911,新北市220板橋區南雅東路,121.45415,25.00665
531,十分瀑布公園,886-2-24958409 ,新北市226平溪區乾坑10號,121.78746,25.04897
532,草里漁港,886-2-28058476,新北市253石門區草里里淡金公路旁,121.60624,25.28236
533,滬尾馬偕醫館,886-2-26292515,新北市251淡水區馬偕街6號,121.43855,25.1718
534,大粗坑古道,886-2-24972250,新北市224瑞芳區大粗坑,121.84224,25.09123
535,新北市市民廣場,886-2-29603456,新北市220板橋區中山路一段161號,121.46529,25.0129
536,舊草嶺環狀自行車道,886-2-24991210,新北市228貢寮區,121.95831,25.0049
537,雲森瀑布,"886-2-26711017	",新北市237三峽區雲森瀑布,121.46603,24.83442
538,陽明山天籟渡假酒店,886-2-24080000,新北市208金山區名流路1-7號,121.59541,25.20194
539,坪林親水吊橋,886-2-26657251,新北市232坪林區坪林旅遊服務中心斜對面,121.70408,24.93501
540,坪林生態園區,886-2-26657251,新北市232坪林區水德里水聳淒坑19-1號旁(茶業博物館旁),121.71337,24.93469
